id|image|name|region|state|description
0|300px-American_Chop_Suey.jpg|American chop suey|Northeast|Connecticut,Maine,Massachusetts,New Hampshire,Rhode Island,Vermont|An American dish of elbow macaroni, ground beef, tomato sauce, seasonings, and sometimes grated cheese.
1|300px-Goulash_from_usa_salvaged.jpg|American goulash|Multiple|Illinois,Indiana,Iowa,Kansas,Michigan,Minnesota,Missouri,Nebraska,North Dakota,Ohio,South Dakota,Wisconsin,Alabama,Arkansas,Delaware,Florida,Georgia,Kentucky,Louisiana,Maryland,Mississippi,North Carolina,Oklahoma,South Carolina,Tennessee,Texas,Virginia,West Virginia|A dish that is similar to American chop suey, consisting of pasta (such as macaroni or egg noodles), ground beef, tomatoes or tomato sauce, and seasonings. Some variations include cheese.
3|300px-Barbecue_spaghetti.jpg|Barbecue spaghetti|South|Tennessee|Spaghetti noodles topped with a sauce made from smoked pork, vegetables, and barbecue sauce.
4|300px-American_biscuits_and_gravy.jpg|Biscuits and gravy|South|Alabama,Arkansas,Delaware,Florida,Georgia,Kentucky,Louisiana,Maryland,Mississippi,North Carolina,Oklahoma,South Carolina,Tennessee,Texas,Virginia,West Virginia|Soft dough biscuits, generally split into halves and covered in either sawmill or sausage gravy.
5|300px-Tacos-with-rice-and-borracho-beans.jpg|Borracho beans|Southwest|Texas|Pinto beans cooked with beer, pork or bacon, and spices such as onions, garlic, and jalapeño peppers. A Tex-Mex dish; the name means "drunken beans".
7|300px-Cheese-straws-01.jpg|Cheese straws|South|Alabama,Arkansas,Delaware,Florida,Georgia,Kentucky,Louisiana,Maryland,Mississippi,North Carolina,Oklahoma,South Carolina,Tennessee,Texas,Virginia,West Virginia|A savory biscuit-like snack made with flour, butter, salt, cheddar cheese, and cayenne pepper; sometimes the dough is extruded through a cookie press before being baked
8|300px-Chili_burger_%28cropped%29.jpg|Chili burger|West|Los Angeles|Also known as a chili size. A hamburger (or cheeseburger) topped with chili con carne.
9|300px-2010-02-14_Giant_steak_chimichanga_at_Cosmic_Cantina.jpg|Chimichanga|Southwest|Arizona|A deep-fried burrito, usually made with a flour tortilla and various fillings such as beans, rice, cheese, and some type of meat.
10|300px-Kegchislicsmall.jpg|Chislic|Midwest|South Dakota|Small cubes of mutton (or sometimes beef, pork, or venison), deep-fried and served on skewers or toothpicks.
12|300px-City-chicken.JPG|City chicken|Midwest|Pennsylvania,Ohio,Michigan,Indiana|Cubes of meat (usually pork) which have been placed on a wooden skewer (approximately 4–5 inches (10–13 cm) long), then fried or baked.
15|300px-Eggs_Sardou.jpg|Eggs Sardou|South|Louisiana|Poached eggs, artichoke bottoms, creamed spinach, and hollandaise sauce, sometimes with other ingredients such as anchovies or chopped ham.
16|300px-Crawfish_etouffee.jpg|Étouffée|South|Louisiana,Mississippi|Étouffée (/eɪtuːˈfeɪ/ ay-too-FAY) is crawfish (or sometimes other shellfish such as shrimp or crabs) cooked using a technique called smothering, with roux, Cajun spices, and other ingredients, and served with rice.
17|300px-Fried_Cheese_Curds_Green_Bay_Wisconsin.JPG|Fried cheese curds|Midwest|Wisconsin|Cheese curds that are battered and deep fried.
19|300px-Frito_Pie_-_served_in_the_bag_%2816847451034%29.jpg|Frito pie|Southwest|Southwestern United States|A dish made with chili, cheese, and corn chips (especially Fritos). Additions can include pico de gallo, refried beans, sour cream, onions, rice, and jalapeños.
20|300px-Garbage_plate.jpg|Garbage Plate|Northeast|New York|A choice of two entrees such as cheeseburger, hamburger, red hots, white hots, Italian sausage, chicken tenders, fried haddock, fried ham, grilled cheese, or eggs; and two sides of either home fries, French fries, baked beans, or macaroni salad; topped with mustard, onions, and a meat sauce of slowly simmered ground beef and spices; usually served with Italian bread and butter on the side.
21|300px-Goetta_tube.jpg|Goetta|Midwest|Ohio|Goetta (/ˈɡɛtə/ GHET-ə) is ground pork or beef mixed with steel-cut oats and seasonings, formed into a log, sliced, and fried.  It originated in the Over-the-Rhine neighborhood of Cincinnati.
22|300px-GreenGoddessGritsGrillades.JPG|Grillades|South|Louisiana|Grillades (/ɡriːˈjɑːdz/ gree-YAHDZ) are fried or seared medallions of meat, usually beef, cooked with Creole-style vegetables and spices.
23|300px-Hotdish.jpg|Hotdish|Midwest|Minnesota|A variety of casserole which typically contains a starch, a meat or other protein, and a canned or frozen vegetable, mixed with canned soup
24|300px-Hushpuppies_5stack.jpg|Hushpuppy|South|Alabama,Arkansas,Delaware,Florida,Georgia,Kentucky,Louisiana,Maryland,Mississippi,North Carolina,Oklahoma,South Carolina,Tennessee,Texas,Virginia,West Virginia|A savory food made from cornmeal batter that is deep fried or baked rolled as a small ball
25|Johnny_Mazetti.jpg|Johnny Marzetti|Midwest|Illinois,Indiana,Iowa,Kansas,Michigan,Minnesota,Missouri,Nebraska,North Dakota,Ohio,South Dakota,Wisconsin|A Midwestern Italian American pasta dish consisting of noodles, cheese, ground beef, and a tomato sauce that typically includes aromatic vegetables and mushrooms.
26|300px-Klobasnek_with_cheese_little_czech.jpg|Klobásník|South|Texas|A klobasnek (meaning "sausage roll") is an American Czech savory finger food. Unlike kolaches, which are sweet and which came to the United States with Czech immigrants, klobasneks were first made by Czechs who settled in Texas.
27|300px-Laulau.jpg|Laulau|West|Hawaii|A traditional preparation consisting of pork wrapped in taro leaf
28|300px-Liver_Mush.jpg|Livermush|South|North Carolina|A dish made with pig liver and other parts mixed with cornmeal, formed into a loaf, and fried.
29|300px-Loco_Moco.jpg|Loco moco|West|Hawaii|There are many variations, but the traditional loco moco consists of white rice, topped with a hamburger patty, a fried egg, and brown gravy
30|300px-San_Francisco_burrito-sparkletack-2005.jpg|Mission burrito|West|California|A very large burrito filled with meat, beans, rice, and additional flavor-enhancing ingredients such as cheese, sour cream, guacamole, pico de gallo, or jalapeños.  Typically served wrapped in aluminum foil.
31|300px-Natchitoches-meatpies-and-beans-rice.jpg|Natchitoches meat pie|South|Louisiana|Ground beef, ground pork, onions, peppers, garlic, oil, and a pie shell
33|300px-Cornish_pasty_-_cut.jpeg|Pasty|Midwest|Michigan|A baked pastry, a traditional variety of which is filled with beef, pork, lamb, or venison, with onions, potatoes, and carrots. Usually handheld with a crispy outer crust.
37|300px-Sweet_Vegan_Corn_Tomatillo_Pudding_%284276798329%29.jpg|Pudding corn|Multiple|Alabama,Arkansas,Delaware,Florida,Georgia,Kentucky,Louisiana,Maryland,Mississippi,North Carolina,Oklahoma,South Carolina,Tennessee,Texas,Virginia,West Virginia,Maryland,New York,North Carolina,Ohio,Pennsylvania,|Also known as corn pudding.  A savory, baked casserole made with corn kernels (and sometimes cornmeal), eggs, cream or milk, and other ingredients.  Usually served as a side dish.
38|300px-Runza_01.jpg|Runza|Midwest|Nebraska,Kansas|A hand-held meat pie similar to a bierock, with a yeast dough bread pocket and a filling of ground beef, shredded cabbage, and seasonings.
39|300px-Plate_of_scrapple.jpg|Scrapple|Northeast|Pennsylvania,Delaware|Traditionally, a mush of pork scraps and trimmings combined with cornmeal and wheat flour, often buckwheat flour, and spices
40|300px-Slinger1.jpg|Slinger|Midwest|Missouri|A diner specialty typically consisting of two eggs, hash browns, and a beef patty, all covered in chili con carne and topped with cheese and onions.
41|300px-Homemade_Spam_Musubi.jpg|Spam musubi|West|Hawaii|A piece of grilled Spam on top of a rice ball, held together with a strip of nori.  This is similar to nigiri sushi, but with Spam instead of raw fish.
42|300px-Spoonbread_with_pork_chop_and_greens.jpg|Spoonbread|South|Alabama,Arkansas,Delaware,Florida,Georgia,Kentucky,Louisiana,Maryland,Mississippi,North Carolina,Oklahoma,South Carolina,Tennessee,Texas,Virginia,West Virginia|A moist cornmeal-based dish, similar in consistency and taste to Yorkshire pudding.  (Pictured is spoonbread underneath a pork chop, with a side of greens.)
43|300px-Steamed_cheeseburger.jpg|Steamed cheeseburger|Northeast|Connecticut|Ground beef is steamed on a tray to create a juicy patty without any grease. Steamed cheese, raw onion and mustard toppings are added afterwards.
44|300px-HomemadeStromboliAug05.jpg|Stromboli|Northeast|Pennsylvania|A type of savory turnover filled with various cheeses, typically mozzarella, Italian meats such as salami, capicola and bresaola or vegetables, and traditionally wrapped in Italian bread dough. It was invented in 1950 at Romano's Pizzeria & Italian Restaurant in Essington, Pennsylvania, by Nazzareno "Nat" Romano.
45|300px-Succotash.jpg|Succotash|Multiple|Connecticut,Maine,Massachusetts,New Hampshire,Rhode Island,Vermont,Pennsylvania,Alabama,Arkansas,Delaware,Florida,Georgia,Kentucky,Louisiana,Maryland,Mississippi,North Carolina,Oklahoma,South Carolina,Tennessee,Texas,Virginia,West Virginia|A chunky dish that consists primarily of sweet corn with lima beans or other shell beans. Other ingredients may be added including tomatoes and green or sweet red peppers.
46|300px-Toasted_Ravioli.jpg|Toasted ravioli|Midwest|Missouri|A dish of breaded, deep-fried ravioli, found on the menus of many St. Louis restaurants including those of the Hill, a predominantly Italian neighborhood.
59|300px-Anadama_bread_%281%29.jpg|Anadama bread|Northeast|Connecticut,Maine,Massachusetts,New Hampshire,Rhode Island,Vermont|A traditional yeast bread of New England made with wheat flour, cornmeal, molasses and sometimes rye flour
60|300px-Flickr_stuart_spivack_8254492--Beaten_biscuits.jpg|Beaten biscuits|South|Alabama,Arkansas,Delaware,Florida,Georgia,Kentucky,Louisiana,Maryland,Mississippi,North Carolina,Oklahoma,South Carolina,Tennessee,Texas,Virginia,West Virginia|A dense biscuit, sometimes served with ham.  Before baking the dough is beaten extensively with a rolling pin or other blunt instrument.
62|300px-Day_20_-_Hot_Water_Cornbread_%284446223148%29.jpg|Hot water corn bread|South|Alabama,Arkansas,Delaware,Florida,Georgia,Kentucky,Louisiana,Maryland,Mississippi,North Carolina,Oklahoma,South Carolina,Tennessee,Texas,Virginia,West Virginia|Cornbread made by mixing cornmeal and water and cooking the resulting batter in a skillet with cooking oil.
63|300px-Johnnycakes_%28cropped%29.jpg|Johnnycakes|Northeast|Alabama,Arkansas,Delaware,Florida,Georgia,Kentucky,Louisiana,Maryland,Mississippi,North Carolina,Oklahoma,South Carolina,Tennessee,Texas,Virginia,West Virginia,Maryland,New York,North Carolina,Ohio,Pennsylvania,|Also known as hoecakes. Cornmeal flatbread, a dish of Native American origin.
64|300px-Parker_House_Rolls.jpg|Parker House roll|Northeast|Massachusetts|A bread roll that was invented at the Parker House Hotel in Boston during the 1870s. It may be served as a side dish.
68|300px-Buffalo_wings-01.jpg|Buffalo wings|Northeast|New York|Chicken wing sections (wingettes and drumettes) that are deep-fried, unbreaded, and coated in a hot sauce made with cayenne pepper, vinegar, and butter. Usually served with celery or carrot sticks, and bleu cheese or ranch dressing for dipping.
70|300px-Chicken_and_waffles_with_peaches_and_cream.jpg|Chicken and waffles|Multiple|Alabama,Arkansas,Delaware,Florida,Georgia,Kentucky,Louisiana,Maryland,Mississippi,North Carolina,Oklahoma,South Carolina,Tennessee,Texas,Virginia,West Virginia,Connecticut,Maine,Massachusetts,New Hampshire,Rhode Island,Vermont|The soul food version of chicken and waffles, popular in the South, pairs fried chicken with a breakfast waffle.  The Pennsylvania Dutch version, found in the Northeast, consists of a plain waffle with pulled, stewed chicken on top, covered in gravy.
71|300px-Chicken_Divan.jpg|Chicken Divan|Northeast|New York|A chicken casserole usually served with broccoli, almonds, and Mornay sauce. It was named after the place of its invention, the Divan Parisienne Restaurant in the Chatham Hotel.
74|300px-Chicken_Riggies.jpg|Chicken riggies|Northeast|New York|An Italian-American pasta dish of chicken, rigatoni, and hot or sweet peppers, in a spicy cream and tomato sauce.
77|300px-Princes_hot_chicken.jpg|Hot chicken|South|Tennessee|A portion of breast, thigh, or wing that has been marinated in buttermilk, floured, fried, and finally sauced using an oil-based paste that has been spiced with cayenne pepper.
78|300px-Moravian_Chicken_Pie.jpg|Moravian chicken pie|South|North Carolina|A savory pie containing no vegetables and filled only with chicken meat and a small amount of thickened broth. Served with hot chicken gravy on top.
80|300px-Bananas_Foster_at_Stanley%27s.jpg|Bananas Foster|South|Louisiana|A dessert made from bananas and vanilla ice cream, with a sauce made from butter, brown sugar, cinnamon, dark rum, and banana liqueur. The butter, sugar and bananas are cooked, then the alcohol is added and ignited as a flambé. The bananas and sauce are served over the ice cream.
81|300px-BeignetsPowderdSugarCDM.jpg|Beignet|South|Louisiana|A beignet (/bɛnˈjeɪ/ ben-YAY) is a square-shaped pastry made with deep-fried choux dough and topped with powdered sugar.
85|300px-Chantilly_cake.JPG|Chantilly cake|West|Hawaii|A modified German chocolate cake without coconut or nuts in its frosting, although it is occasionally topped with macadamia nuts.
86|300px-Chess_pie.jpg|Chess pie|South|Alabama,Arkansas,Delaware,Florida,Georgia,Kentucky,Louisiana,Maryland,Mississippi,North Carolina,Oklahoma,South Carolina,Tennessee,Texas,Virginia,West Virginia|A simple, sweet custard-like pie that is made from eggs, butter, sugar, and optionally a flavoring such as lemon, orange, or chocolate.
87|300px-Kentucky_Chocolate_walnut_pie_slice.JPG|Derby pie|South|Kentucky|Derby pie is a chocolate and walnut tart in a pie shell with a pastry dough crust.
88|300px-Doberge_Layers.JPG|Doberge cake|South|Louisiana|Doberge (/doʊˈbɜːrʒ/ doh-BURZH) cake is a cake with many thin layers, separated with dessert pudding (often half chocolate and half lemon), and with a glazed outer frosting.
89|300px-Fortune_cookies.jpg|Fortune cookie|West|California|A crisp, sugary cookie wafer usually made from flour, sugar, vanilla and sesame seed oil, containing a piece of paper inside bearing a "fortune", usually an aphorism or a vague prophecy, and typically served after a Chinese meal. Makoto Hagiwara of the Tea House in the Japanese Tea Garden in San Francisco's Golden Gate Park reportedly first served the modern version of the cookie in the 1890s or early 1900s.
90|300px-FrozenBanana.JPG|Frozen banana|West|California|Made by putting a banana on a stick, freezing it, and dipping it in melted chocolate. May be covered with toppings such as chopped nuts, sprinkles, sugar, and crushed cookies.
91|300px-Gooey_Butter_Cake_Photo.jpg|Gooey butter cake|Midwest|Missouri|A flat, dense cake made with yellow box cake mix, butter, sugar, and eggs, and cream cheese typically about 1 inch (2.5 cm) tall, and can be dusted with powdered sugar.
92|300px-Happy_Cake_1967.jpg|Happy Cake|West|Hawaii|A tropical cake prepared with pineapple, coconut and macadamia nuts, it is often referred to as Hawaii's version of a fruit cake.
93|Slab_of_haupia.jpg|Haupia|West|Hawaii|Haupia (/haʊˈpiːə/ how-PEE-ə) is a dish in the native cuisine of Hawaii, it is a coconut milk-based Hawaiian dessert often found at luaus and other local gatherings in Hawaiʻi
95|300px-Hummingbird_cake_-_homemade.jpg|Hummingbird cake|South|Alabama,Arkansas,Delaware,Florida,Georgia,Kentucky,Louisiana,Maryland,Mississippi,North Carolina,Oklahoma,South Carolina,Tennessee,Texas,Virginia,West Virginia|A banana-pineapple spice cake that has been a tradition in Southern cuisine since the mid-20th century. The first known publication of the recipe, as written by L.H. Wiggin, was in the February 1978 issue of Southern Living.
97|300px-Florida_Key_Lime_Pie.JPG|Key lime pie|South|Florida|A pie made with key lime juice, egg yolks, and sweetened condensed milk, with a meringue topping.
98|300px-Kingcake.jpg|King cake|South|Louisiana|A cake made of braided pastry laced with cinnamon, with purple, green, and gold frosting, and a small plastic baby hidden inside.  Eaten during Mardi Gras season.
99|300px-Kulolo-02.jpg|Kulolo|West|Hawaii|A dessert made from mashed kalo (taro) corms, grated coconut meat or coconut milk, and sugar
100|300px-Slice_of_lane_cake.jpg|Lane cake|South|Georgia,Alabama,Mississippi|Also known as a prize cake; a bourbon-soaked layer cake
102|300px-Mississippi_Mud_Pie.jpg|Mud pie|South|Mississippi|A chocolate-based dessert pie.
103|300px-Scotch_kisses.jpg|Modjeska|South|Kentucky|A marshmallow dipped in caramel.
104|300px-Sugar_Cake.jpg|Moravian sugar cake|South|North Carolina|A traditional sweet coffee cake topped with butter, brown sugar and cinnamon which was popularized by Moravians in North Carolina.
106|300px-Pecan_pie%2C_November_2010.jpg|Pecan pie|South|Alabama,Arkansas,Delaware,Florida,Georgia,Kentucky,Louisiana,Maryland,Mississippi,North Carolina,Oklahoma,South Carolina,Tennessee,Texas,Virginia,West Virginia|A pie made primarily of eggs and corn syrup with pecan nuts.
107|300px-Salt_water_taffy.jpg|Salt water taffy|Northeast|New Jersey|Originally produced and marketed in the Atlantic City, New Jersey area starting in the 1880s
108|300px-Shaker_lemon_pie.jpg|Shaker lemon pie|Midwest|Ohio|A pie with a filling made with whole lemons that have been sliced extremely thin and macerated with sugar.
109|300px-Wet-bottom_Shoofly_Pie.jpg|Shoofly pie|Northeast|Pennsylvania|A pie with a cake-like consistency, made with molasses.
110|300px-GrannySmithAppleSalad.jpg|Snickers salad|Midwest|Iowa|A mix of Snickers bars, Granny Smith apples, whipped cream, and often pudding or whipped topping, served in a bowl.
111|300px-Pie_capers_strawberry_rhubarb_pie%2C_July_2007.jpg|Strawberry rhubarb pie|Northeast|Connecticut,Maine,Massachusetts,New Hampshire,Rhode Island,Vermont, New York|A sweet and tart pie made with strawberries and rhubarb, with a latticed top crust.
113|300px-Maple_toffee.JPG|Sugar on snow|Northeast|Vermont,New York,Quebec|Also known as "tire sur la neige" (French for "pull over snow"). A candy made by boiling maple syrup and pouring it over clean snow to harden it. Popular at seasonal "sugaring-off" events where freshly tapped maple syrup is boiled and guests receive a small spoon or popscile stick to roll the still-warm maple onto.
116|300px-Chocolate_Chip_Cookies_-_kimberlykv.jpg|Toll House cookie|Northeast|Massachusetts|A cookie made with butter, brown sugar, and white sugar, with semi-sweet chocolate chips.  Invented at the Toll House Inn in Whitman, Massachusetts.
117|300px-Tipsy_cake.jpg|Tipsy cake|South|Alabama,Arkansas,Delaware,Florida,Georgia,Kentucky,Louisiana,Maryland,Mississippi,North Carolina,Oklahoma,South Carolina,Tennessee,Texas,Virginia,West Virginia|A variation on the English trifle brought to America in colonial times. A cake made with an alcoholic beverage such as wine, sherry, or bourbon, and often with custard, jam, or fruit.
118|300px-Whoopie_pie_with_dusting_of_confectioner%27s_sugar.jpg|Whoopie pie|Northeast|Maine,Pennsylvania|A baked product made of two round mound-shaped pieces of chocolate cake with a sweet, creamy filling or frosting sandwiched between them.
119|300px-Cioppino.jpg|Cioppino|West|California|Cioppino (/tʃoʊˈpiːnoʊ/ choh-PEE-noh) is an Italian-American fish stew with tomatoes and a variety of fish and shellfish.
120|300px-New_England_clam_bake.jpg|Clambake|Northeast|Connecticut,Maine,Massachusetts,New Hampshire,Rhode Island,Vermont|Seafood and vegetables steamed between layers of seaweed over hot rocks on a beach.
121|300px-Clam_cake.jpg|Clam cakes|Northeast|Rhode Island|Fritter made from flour, water, baking powder, clam juice, and chopped or minced clams (usually quahogs) all mixed together, rolled into balls and deep fried.
122|300px-Clams_casino.jpg|Clams casino|Northeast|Rhode Island|A clam served on a half clamshell, topped with breadcrumbs and crumbled bacon, and broiled.
124|300px-DoorCountyWI_FishBoilPlatter.jpg|Fish boil|Midwest|Wisconsin|Freshwater whitefish, potatoes, and onions are boiled in a large pot of salty water, with the fish and potatoes in wire baskets.  When the fish is ready, the fish oil, which has floated to the top, is removed, traditionally with burning kerosene.
125|300px-Shrimp_Boil.jpg|Frogmore stew|South|South Carolina,Georgia|Frogmore stew, also known as low country boil, is a dish consisting of shell-on shrimp, smoked sausage, corn, and red potatoes all cooked together in a spice laden broth. It's typically served family style, on newspaper with lemon, cocktail sauce, and drawn butter.
126|300px-Hangtown_Burger.jpg|Hangtown fry|West|California|Hangtown fry is a type of omelette made famous during the California Gold Rush in the 1850s. The most common version includes bacon and oysters combined with eggs, and fried together.
127|300px-Lobster_newburg_%286161063979%29.jpg|Lobster Newberg|Northeast|New York|An American seafood dish made from lobster, butter, cream, cognac, sherry, eggs, and cayenne pepper.
128|300px-Oysters_Bienville.jpg|Oysters Bienville|South|Louisiana|A traditional dish in New Orleans cuisine,
130|300px-Oysters_rockefeller.jpg|Oysters Rockefeller|South|Louisiana|Oysters on the half-shell that have been topped with various other ingredients (often parsley and other green herbs, a rich butter sauce and bread crumbs) and are then baked or broiled
131|300px-Shrimp_and_grits_at_the_Green_Goddess.jpg|Shrimp and grits|South|South Carolina|Grits with cooked shrimp added, usually served for breakfast.
133|300px-Shrimp-DeJonghe-01.jpg|Shrimp DeJonghe|Midwest|Illinois|A casserole of large, peeled shrimp, soft breadcrumbs, and a rich sauce made with butter, garlic, and white wine or sherry.
134|300px-Stuffed_clams_food_dinner_cooking.jpg|Stuffies|Northeast|Connecticut,Maine,Massachusetts,New Hampshire,Rhode Island,Vermont|Also known as stuffed clams or stuffed quahogs. Quahog clams, minced and mixed with breadcrumbs and sometimes other ingredients, baked on the half-shell.
135|300px-Hawaiian-dishes-01.jpg|Squid lū'au|West|Hawaii|Made with squid (or octopus), taro (lu'au) leaves, coconut milk, garlic, water, and Hawaiian salt. (Squid lū'au is pictured at the very bottom of the image.)
136|300px-Bageldog.jpg|Bagel dog|Northeast, Midwest|New York, Illinois,Ohio|A full-size or miniature hot dog, wrapped in bagel-style breading before or after cooking.
137|300px-Beer-brats-01.jpg|Beer brat|Midwest|Wisconsin|A bratwurst simmered in beer and then grilled.
138|300px-Smoked_Boudin_Blanc.jpg|Boudin|South|Southern Louisiana|A sausage made with pork, rice, and Cajun spices.
141|300px-Skyline_Chili_Coneys.jpg|Coney|Midwest|Ohio|A hot dog topped with a spiced meat sauce called Cincinnati chili, mustard, diced onions, and sometimes cheese.
142|300px-Flint_coney_island.jpg|Coney Island hot dog|Midwest|Michigan,Indiana|A large, natural-casing hot dog topped with a hearty, mildly spiced meat sauce, and with mustard and diced onions.
143|300px-Dodger_Dog_by_Farmer_John.jpg|Dodger Dog|West|Los Angeles|A 10-inch (25 cm) hot dog wrapped in a steamed bun.
147|300px-Polish%2C_Pork_Chop_%26_Onions.JPG|Maxwell Street Polish|Midwest|Illinois|A Polish sausage made with beef and pork, and with garlic and other spices.  Served on a bun with grilled onions.
148|Coneyhdog.jpg|Michigan hot dog|Northeast|New York|A natural-casing hot dog made of beef and pork, sometimes bright red in color, on a steamed bun, topped with a meat sauce made with hamburger meat, tomatoes, and spices.  Optionally also topped with onions and yellow mustard.
149|300px-HotWeinersWein-O-Rama.jpg|New York System wiener|Northeast|Rhode Island|A sausage similar to a hot dog, made of veal and pork, served in a steamed bun, and topped with celery salt, yellow mustard, chopped onions, and a seasoned meat sauce made from ground beef.
150|300px-Polish_boy.jpg|Polish Boy|Midwest|Ohio|A kielbasa sausage covered with French fries, barbecue sauce, and cole slaw, served in a long bun.
151|300px-Rippers_with_onion_rings.jpg|Ripper|Northeast|New Jersey|A hot dog that is deep-fried until the casing rips.
153|300px-Sonoran_dog_GC_0052.jpg|Sonoran hot dog|Southwest|Arizona|A hot dog wrapped in bacon and grilled, served on a bolillo-style hot dog bun, and topped with pinto beans, onions, tomatoes, and a variety of additional condiments, often including mayonnaise, mustard, and jalapeño salsa.
155|300px-White_hot_dog_exterior_detail.JPG|White hot|Northeast|New York|A hot dog made with a combination of uncured and unsmoked pork, beef, and veal.  The lack of smoking or curing allows the meat to retain a naturally white color.  White hots usually contain mustard and other spices, and often include a dairy component such as nonfat dry milk.
158|300px-Grandma-pizza-01.jpg|Grandma pizza|Northeast|New York|Thin-crust pizza topped sparingly with shredded mozzarella, crushed uncooked canned tomatoes, chopped garlic, and olive oil, cooked in a rectangular pan and then cut into squares.
161|300px-Pizza_bagel_1.jpg|Pizza bagel|Midwest|Ohio|The two halves of a toasted bagel, baked with tomato sauce, mozzarella cheese, and often other pizza toppings.
162|300px-Pizza-Puff-02.jpg|Pizza puff|Midwest|Illinois|A deep-fried dough pocket filled with cheese, tomato sauce, and other pizza ingredients such as sausage.  Can be found at some hot dog stands and casual dining restaurants.
165|300px-TomatoPie.jpg|Tomato pie|Northeast|New Jersey|Thick-crust pizza dish cooked with cheese underneath a large amount of garlicky tomato sauce, cooled to room temperature before serving.
